{
  "schemaVersion": 1,
  "inventoryVersion": "legacy-taxonomy-raw-v1",
  "source": {
    "repository": "Xpotato1024/xpotato-site",
    "tag": "legacy-pre-vnext-2026-08-28",
    "tagObjectSha": "8503f5a50a5fb3d27a02422da0b50dc66c818b02",
    "commitSha": "927d105713561309fc5e2374396f86646b5aeb2a",
    "inventoryPayloadSha256": "9151be197d9e48a12297d45dfdd2a72a15cf9ce16f143fdc16b60e5345d37493"
  },
  "mappingPayloadSha256": "f1f1bb4d49ffb838720cfbe417fcec34988dba1aec7c72c30daa4cd2fc30b3a9",
  "candidateManifestPayloadSha256": "fc1cd9079b304c1c660de9ecf40c0201285de078cf5fe652b6df335dbbcf3745",
  "materializationManifestPayloadSha256": "72ba1b79b550bb8e15ed68dfaa81d2ae8e730784497a96d419b32417a9f39fcb",
  "sourceCandidateCount": 53,
  "taxonomyPendingContentCount": 52,
  "rawTermOccurrenceCount": 354,
  "uniqueRawTermCount": 98,
  "terms": [
    {
      "namespace": "blog_category",
      "rawValue": "devlog",
      "normalizedValue": "devlog",
      "occurrenceCount": 31,
      "usages": [
        {
          "kind": "blog_category",
          "occurrenceCount": 31,
          "affectedLegacyContentIds": [
            "blog:codex-sqlite-write-amplification-mitigation",
            "blog:gale-adaptive-conservative-planner",
            "blog:gale-adaptive-multi-run-review",
            "blog:gale-adaptive-planner-gpu-query-eligibility",
            "blog:gale-adaptive-review-checklist",
            "blog:gale-adaptive-rule-governance",
            "blog:gale-adaptive-rule-promotion-gate",
            "blog:gale-adaptive-rule-table",
            "blog:gale-adaptive-shadow-evaluation",
            "blog:gale-cli-distribution-roadmap-package-managers",
            "blog:gale-cpu-gpu-acceleration-paths",
            "blog:gale-cpu-index-build-parallel",
            "blog:gale-gpu-buffer-reuse",
            "blog:gale-gpu-chunked-selection-benchmark",
            "blog:gale-gpu-exact-hit-compaction",
            "blog:gale-gpu-group-aware-ranking",
            "blog:gale-gpu-host-copy-reduction",
            "blog:gale-gpu-on-device-upload-cache",
            "blog:gale-gpu-partial-readback",
            "blog:gale-gpu-partial-readback-benchmark",
            "blog:gale-gpu-partial-readback-stage-breakdown",
            "blog:gale-gpu-pipeline-cache",
            "blog:gale-gpu-readback-strategy-gating",
            "blog:gale-gpu-score-row-dedup",
            "blog:gale-gpu-score-tie-skip",
            "blog:gale-gpu-strategy-boundary-matrix",
            "blog:gale-gpu-tie-shortlist-readback",
            "blog:gale-gpu-top-k-exact-cutoff",
            "blog:gale-gpu-topk-boundary-shortlist",
            "blog:gale-storage-backend-compare",
            "blog:gale-v010-alpha1-release-workflow"
          ]
        }
      ],
      "affectedLegacyContentIds": [
        "blog:codex-sqlite-write-amplification-mitigation",
        "blog:gale-adaptive-conservative-planner",
        "blog:gale-adaptive-multi-run-review",
        "blog:gale-adaptive-planner-gpu-query-eligibility",
        "blog:gale-adaptive-review-checklist",
        "blog:gale-adaptive-rule-governance",
        "blog:gale-adaptive-rule-promotion-gate",
        "blog:gale-adaptive-rule-table",
        "blog:gale-adaptive-shadow-evaluation",
        "blog:gale-cli-distribution-roadmap-package-managers",
        "blog:gale-cpu-gpu-acceleration-paths",
        "blog:gale-cpu-index-build-parallel",
        "blog:gale-gpu-buffer-reuse",
        "blog:gale-gpu-chunked-selection-benchmark",
        "blog:gale-gpu-exact-hit-compaction",
        "blog:gale-gpu-group-aware-ranking",
        "blog:gale-gpu-host-copy-reduction",
        "blog:gale-gpu-on-device-upload-cache",
        "blog:gale-gpu-partial-readback",
        "blog:gale-gpu-partial-readback-benchmark",
        "blog:gale-gpu-partial-readback-stage-breakdown",
        "blog:gale-gpu-pipeline-cache",
        "blog:gale-gpu-readback-strategy-gating",
        "blog:gale-gpu-score-row-dedup",
        "blog:gale-gpu-score-tie-skip",
        "blog:gale-gpu-strategy-boundary-matrix",
        "blog:gale-gpu-tie-shortlist-readback",
        "blog:gale-gpu-top-k-exact-cutoff",
        "blog:gale-gpu-topk-boundary-shortlist",
        "blog:gale-storage-backend-compare",
        "blog:gale-v010-alpha1-release-workflow"
      ],
      "requiresTechnologyKind": false,
      "termPayloadSha256": "bbdfb62adba44b95b5b1a35e21e08bff895daf9d6d8723e7123ff1e0febeece3"
    },
    {
      "namespace": "blog_category",
      "rawValue": "diary",
      "normalizedValue": "diary",
      "occurrenceCount": 1,
      "usages": [
        {
          "kind": "blog_category",
          "occurrenceCount": 1,
          "affectedLegacyContentIds": [
            "blog:vibration-robot"
          ]
        }
      ],
      "affectedLegacyContentIds": [
        "blog:vibration-robot"
      ],
      "requiresTechnologyKind": false,
      "termPayloadSha256": "682ca224f0f0237ec3e6bf16869ae6ae69998c2b1f1b100a5897304cd3c31752"
    },
    {
      "namespace": "blog_category",
      "rawValue": "infra",
      "normalizedValue": "infra",
      "occurrenceCount": 7,
      "usages": [
        {
          "kind": "blog_category",
          "occurrenceCount": 7,
          "affectedLegacyContentIds": [
            "blog:anythingllm-vllm-followup-streaming-workaround",
            "blog:compacting-wsl-vhd-in-place-after-c-drive-move",
            "blog:moving-wsl-home-distro-to-c-drive-after-stuck-move",
            "blog:rag-phase1-retrieval-tuning-anythingllm",
            "blog:rag-phase2-qdrant-rerank-anythingllm",
            "blog:self-hosted-rag-with-vllm-qwen35-4b",
            "blog:stabilizing-wsl-home-after-vhd-growth"
          ]
        }
      ],
      "affectedLegacyContentIds": [
        "blog:anythingllm-vllm-followup-streaming-workaround",
        "blog:compacting-wsl-vhd-in-place-after-c-drive-move",
        "blog:moving-wsl-home-distro-to-c-drive-after-stuck-move",
        "blog:rag-phase1-retrieval-tuning-anythingllm",
        "blog:rag-phase2-qdrant-rerank-anythingllm",
        "blog:self-hosted-rag-with-vllm-qwen35-4b",
        "blog:stabilizing-wsl-home-after-vhd-growth"
      ],
      "requiresTechnologyKind": false,
      "termPayloadSha256": "88d0454215b30d0a5f6249d8043f77d7713b6b7ee231fd5e73932cab5897e727"
    },
    {
      "namespace": "blog_category",
      "rawValue": "network",
      "normalizedValue": "network",
      "occurrenceCount": 1,
      "usages": [
        {
          "kind": "blog_category",
          "occurrenceCount": 1,
          "affectedLegacyContentIds": [
            "blog:2025-10-06"
          ]
        }
      ],
      "affectedLegacyContentIds": [
        "blog:2025-10-06"
      ],
      "requiresTechnologyKind": false,
      "termPayloadSha256": "9000681aa7d5e6864cef9f2ccefb3f28ef9ffb81625bd1bf551d9c10e311583f"
    },
    {
      "namespace": "note_subject",
      "rawValue": "infrastructure",
      "normalizedValue": "infrastructure",
      "occurrenceCount": 1,
      "usages": [
        {
          "kind": "note_subject",
          "occurrenceCount": 1,
          "affectedLegacyContentIds": [
            "notes:wordpress-migration-playbook"
          ]
        }
      ],
      "affectedLegacyContentIds": [
        "notes:wordpress-migration-playbook"
      ],
      "requiresTechnologyKind": false,
      "termPayloadSha256": "17e391db6674c3c60e10932abf2c0d11253db9fd4457a7c57d10b75a38449f39"
    },
    {
      "namespace": "tag",
      "rawValue": "AnythingLLM",
      "normalizedValue": "anythingllm",
      "occurrenceCount": 4,
      "usages": [
        {
          "kind": "blog_tag",
          "occurrenceCount": 4,
          "affectedLegacyContentIds": [
            "blog:anythingllm-fresh-thread-reembed-workspace",
            "blog:qdrant-on-disk-payload-windows-backed-storage",
            "blog:qdrant-rebuild-zero-vector-pitfall",
            "blog:repair-qdrant-corruption-anythingllm-smoke-test"
          ]
        }
      ],
      "affectedLegacyContentIds": [
        "blog:anythingllm-fresh-thread-reembed-workspace",
        "blog:qdrant-on-disk-payload-windows-backed-storage",
        "blog:qdrant-rebuild-zero-vector-pitfall",
        "blog:repair-qdrant-corruption-anythingllm-smoke-test"
      ],
      "requiresTechnologyKind": false,
      "termPayloadSha256": "92fe1bbd0317c925881963b4ac1c1166c2a630ee4d7dfb0d20fb5bacbfcc546f"
    },
    {
      "namespace": "tag",
      "rawValue": "Astro",
      "normalizedValue": "astro",
      "occurrenceCount": 1,
      "usages": [
        {
          "kind": "project_technology",
          "occurrenceCount": 1,
          "affectedLegacyContentIds": [
            "projects:xpotato-site"
          ]
        }
      ],
      "affectedLegacyContentIds": [
        "projects:xpotato-site"
      ],
      "requiresTechnologyKind": true,
      "termPayloadSha256": "9a7033b8423fed5d712f8ea5baba4b2ec95f3d1908d5718a72296ae753167850"
    },
    {
      "namespace": "tag",
      "rawValue": "Docker",
      "normalizedValue": "docker",
      "occurrenceCount": 2,
      "usages": [
        {
          "kind": "project_technology",
          "occurrenceCount": 2,
          "affectedLegacyContentIds": [
            "projects:pandocker-x",
            "projects:repo-audit"
          ]
        }
      ],
      "affectedLegacyContentIds": [
        "projects:pandocker-x",
        "projects:repo-audit"
      ],
      "requiresTechnologyKind": true,
      "termPayloadSha256": "31a4a63f93bcd9dc6751999c69ad6680751086bc064400177fcf29a308d55324"
    },
    {
      "namespace": "tag",
      "rawValue": "Firebase",
      "normalizedValue": "firebase",
      "occurrenceCount": 1,
      "usages": [
        {
          "kind": "project_technology",
          "occurrenceCount": 1,
          "affectedLegacyContentIds": [
            "projects:meidaisai-mac"
          ]
        }
      ],
      "affectedLegacyContentIds": [
        "projects:meidaisai-mac"
      ],